{
  "$schema": "./schema.json",
  "version": 1,
  "categories": [
    { "id": "website", "name": "Website", "description": "Marketing and content pages that need to inform, convince and convert." },
    { "id": "web-app", "name": "Web app", "description": "Logged-in product screens where people get real work done." },
    { "id": "mobile", "name": "Mobile", "description": "Native and mobile-first screens built for thumbs, interruptions and small screens." },
    { "id": "design-system", "name": "Design system", "description": "Foundations and components that every other screen is built from." },
    { "id": "flows", "name": "Flows", "description": "Multi-step journeys where a single broken step loses the user." }
  ],
  "checklists": [
    {
      "id": "website/landing-page", "category": "website", "title": "Landing Page", "icon": "🚀",
      "description": "A single page whose job is to turn a visitor into a sign-up, lead or buyer.",
      "items": [
        { "id": "value-prop", "title": "Value proposition above the fold", "description": "A headline that says what it is and who it is for, readable in under five seconds.", "tip": "Test it: cover the logo — could the headline belong to a competitor?", "priority": "must", "tags": ["copy", "ux"] },
        { "id": "primary-cta", "title": "One primary call to action", "description": "A single, visually dominant action repeated at natural decision points down the page.", "priority": "must", "tags": ["ux", "visual"] },
        { "id": "social-proof", "title": "Social proof near the CTA", "description": "Logos, numbers, reviews or quotes placed where doubt is highest — next to the ask.", "priority": "should", "tags": ["copy"] },
        { "id": "product-visual", "title": "Show the product", "description": "A real screenshot, demo or video instead of abstract illustration only.", "priority": "should", "tags": ["visual"] },
        { "id": "objections", "title": "Answer objections", "description": "Pricing hints, security, setup time and cancellation addressed before the visitor has to ask.", "priority": "should", "tags": ["copy"] },
        { "id": "lcp", "title": "Fast largest contentful paint", "description": "Hero renders in under 2.5s on a mid-range phone over 4G; hero image is sized and preloaded.", "priority": "must", "tags": ["perf"] },
        { "id": "meta", "title": "Share metadata", "description": "Title, description and a 1200×630 Open Graph image so links look intentional when shared.", "priority": "should", "tags": ["seo"] },
        { "id": "mobile-cta", "title": "CTA reachable on mobile", "description": "Primary action visible without hunting on a 375px screen; consider a sticky bar on long pages.", "priority": "should", "tags": ["ux", "mobile"] }
      ]
    },
    {
      "id": "website/pricing", "category": "website", "title": "Pricing", "icon": "💳",
      "description": "Helps a buyer pick the right plan and feel safe paying for it.",
      "items": [
        { "id": "plan-names", "title": "Plans named by who they serve", "description": "Plan names and one-line summaries map to customer types, not internal tiers.", "priority": "should", "tags": ["copy"] },
        { "id": "recommended", "title": "A recommended plan", "description": "One plan is highlighted to reduce choice paralysis.", "priority": "should", "tags": ["ux", "visual"] },
        { "id": "billing-toggle", "title": "Clear billing period", "description": "Monthly/annual toggle shows the saving and the price per month the user actually pays.", "tip": "Show the annual total too — surprises at checkout kill trust.", "priority": "must", "tags": ["copy", "ux"] },
        { "id": "comparison", "title": "Feature comparison", "description": "A scannable table of differences between plans, with shared features grouped instead of repeated.", "priority": "should", "tags": ["ux"] },
        { "id": "currency-tax", "title": "Currency and tax stated", "description": "Currency, whether tax is included, and regional pricing are explicit.", "priority": "must", "tags": ["copy"] },
        { "id": "enterprise", "title": "Path for large teams", "description": "A contact or custom option for buyers who don't fit the published plans.", "priority": "nice", "tags": ["ux"] },
        { "id": "faq", "title": "Billing FAQ", "description": "Refunds, cancellation, trials and plan changes answered on the page.", "priority": "should", "tags": ["copy"] }
      ]
    },
    {
      "id": "website/blog-post", "category": "website", "title": "Blog Post", "icon": "📝",
      "description": "Long-form content that should be comfortable to read and easy to share.",
      "items": [
        { "id": "measure", "title": "Comfortable line length", "description": "Body text between 60 and 80 characters per line with at least 1.5 line height.", "priority": "must", "tags": ["visual", "a11y"] },
        { "id": "meta-info", "title": "Author, date and reading time", "description": "Shown near the title so readers can judge freshness and commitment.", "priority": "should", "tags": ["copy"] },
        { "id": "headings", "title": "Real heading hierarchy", "description": "One h1, sequential h2/h3 — doubles as a skimmable outline and screen-reader navigation.", "priority": "must", "tags": ["a11y", "seo"], "wcag": "1.3.1" },
        { "id": "alt", "title": "Images have alt text", "description": "Informative images describe their content; decorative ones use empty alt.", "priority": "must", "tags": ["a11y"], "wcag": "1.1.1" },
        { "id": "toc", "title": "Table of contents for long posts", "description": "Anchored links for posts longer than ~1,500 words.", "priority": "nice", "tags": ["ux"] },
        { "id": "next", "title": "A next step at the end", "description": "Related posts, newsletter sign-up or product CTA so the reader doesn't hit a dead end.", "priority": "should", "tags": ["ux"] },
        { "id": "code", "title": "Readable code blocks", "description": "Syntax highlighting, horizontal scroll instead of wrapping, and a copy button.", "priority": "nice", "tags": ["visual"] }
      ]
    },
    {
      "id": "website/contact", "category": "website", "title": "Contact Us", "icon": "✉️",
      "description": "Gets people to the right human with the least effort.",
      "items": [
        { "id": "routes", "title": "Routes by intent", "description": "Separate paths for sales, support, press and partnerships so messages land with the right team.", "priority": "should", "tags": ["ux"] },
        { "id": "short-form", "title": "Minimal form", "description": "Only the fields needed to reply — usually name, email and message.", "priority": "must", "tags": ["ux"] },
        { "id": "response-time", "title": "Expected response time", "description": "Tell people when they'll hear back, before and after submitting.", "priority": "should", "tags": ["copy"] },
        { "id": "self-serve", "title": "Self-serve shortcut", "description": "Link to help center or status page for questions that don't need a person.", "priority": "should", "tags": ["ux"] },
        { "id": "alt-channels", "title": "Alternative channels", "description": "Email address, phone or chat for people who won't fill a form.", "priority": "nice", "tags": ["ux"] },
        { "id": "spam", "title": "Spam protection without friction", "description": "Honeypots or invisible checks before resorting to CAPTCHAs.", "priority": "should", "tags": ["security", "a11y"] }
      ]
    },
    {
      "id": "website/404", "category": "website", "title": "404 Page", "icon": "🧭",
      "description": "Turns a dead end into a way back.",
      "items": [
        { "id": "plain", "title": "Plain-language explanation", "description": "Says the page couldn't be found without jargon like 'HTTP 404' as the headline.", "priority": "must", "tags": ["copy"] },
        { "id": "search", "title": "Search box", "description": "Lets people look for what they wanted right there.", "priority": "should", "tags": ["ux"] },
        { "id": "links", "title": "Useful links", "description": "Home plus the most visited sections.", "priority": "must", "tags": ["ux"] },
        { "id": "status", "title": "Correct status code", "description": "Server actually returns 404 so the URL drops out of search indexes.", "priority": "must", "tags": ["seo"] },
        { "id": "report", "title": "Report a broken link", "description": "A lightweight way to flag where the bad link came from.", "priority": "nice", "tags": ["ux"] },
        { "id": "on-brand", "title": "Keeps site navigation", "description": "Header and footer stay so the user isn't stranded.", "priority": "should", "tags": ["ux"] }
      ]
    },
    {
      "id": "website/faq", "category": "website", "title": "FAQ", "icon": "❓",
      "description": "Answers repeated questions before they become support tickets.",
      "items": [
        { "id": "real-questions", "title": "Questions customers actually ask", "description": "Sourced from support tickets and sales calls, phrased in their words.", "priority": "must", "tags": ["copy"] },
        { "id": "grouped", "title": "Grouped by topic", "description": "Billing, account, product, security — not one long list.", "priority": "should", "tags": ["ux"] },
        { "id": "accordion-a11y", "title": "Accessible accordions", "description": "Triggers are buttons with aria-expanded; content is reachable by keyboard.", "priority": "must", "tags": ["a11y"], "wcag": "4.1.2" },
        { "id": "deep-links", "title": "Linkable answers", "description": "Each answer has an anchor so support can link directly to it.", "priority": "nice", "tags": ["ux"] },
        { "id": "search", "title": "Searchable", "description": "Filter or page search for FAQs with more than ~15 entries.", "priority": "nice", "tags": ["ux"] },
        { "id": "escape", "title": "Contact fallback", "description": "A clear way to reach a person when the answer isn't there.", "priority": "should", "tags": ["ux"] }
      ]
    },
    {